CREATE TABLE t1 (id INT PRIMARY KEY, b CHAR(100) DEFAULT 'initial value')
ENGINE=<engine_type>;
INSERT INTO t1(id) VALUES (1), (2), (3), (4), (5), (6), (7), (8);
SELECT MAX(id) FROM t1 INTO @max;
INSERT INTO t1(id) SELECT id + @max FROM t1
WHERE id + @max <= <num_stress_rows>;
SELECT MAX(id) FROM t1 INTO @max;
INSERT INTO t1(id) SELECT id + @max FROM t1
WHERE id + @max <= <num_stress_rows>;
SELECT MAX(id) FROM t1 INTO @max;
INSERT INTO t1(id) SELECT id + @max FROM t1
WHERE id + @max <= <num_stress_rows>;
SELECT MAX(id) FROM t1 INTO @max;
INSERT INTO t1(id) SELECT id + @max FROM t1
WHERE id + @max <= <num_stress_rows>;
SELECT MAX(id) FROM t1 INTO @max;
INSERT INTO t1(id) SELECT id + @max FROM t1
WHERE id + @max <= <num_stress_rows>;
SELECT MAX(id) FROM t1 INTO @max;
INSERT INTO t1(id) SELECT id + @max FROM t1
WHERE id + @max <= <num_stress_rows>;
SELECT MAX(id) FROM t1 INTO @max;
INSERT INTO t1(id) SELECT id + @max FROM t1
WHERE id + @max <= <num_stress_rows>;
SELECT MAX(id) FROM t1 INTO @max;
INSERT INTO t1(id) SELECT id + @max FROM t1
WHERE id + @max <= <num_stress_rows>;
SELECT MAX(id) FROM t1 INTO @max;
INSERT INTO t1(id) SELECT id + @max FROM t1
WHERE id + @max <= <num_stress_rows>;
SELECT MAX(id) FROM t1 INTO @max;
INSERT INTO t1(id) SELECT id + @max FROM t1
WHERE id + @max <= <num_stress_rows>;
UPDATE performance_schema.setup_instruments SET TIMED = 'YES';
UPDATE performance_schema.setup_instruments SET ENABLED = 'NO';
UPDATE performance_schema.setup_instruments SET ENABLED = 'YES'
WHERE NAME IN ('wait/io/file/sql/FRM',
'thread/sql/Connection',
'wait/synch/cond/sql/COND_mdl',
'wait/synch/rwlock/sql/LOCK_sys_init_connect',
'wait/synch/mutex/sql/LOCK_mdl');
UPDATE performance_schema.setup_consumers SET ENABLED = 'YES';
SET @rowid = ROUND(RAND() * <num_stress_rows>);
START TRANSACTION;
UPDATE t1 SET b = 'changed' WHERE id=@rowid;
SELECT b FROM t1 WHERE id=@rowid;
b
changed
COMMIT;
START TRANSACTION;
DELETE FROM t1 WHERE id=@rowid;
INSERT INTO t1 (id, b) VALUES (@rowid, 'newly_inserted');
SELECT b FROM t1 WHERE id=@rowid;
b
newly_inserted
COMMIT;
CREATE TABLE tw_<conn_nr> AS SELECT * FROM t1;
DROP TABLE tw_<conn_nr>;
